{
  "$schema": "https://json-schema.org/draft/2020-12/schema",
  "$id": "IdentityAnchor.schema.json",
  "title": "IdentityAnchor.v1",
  "type": "object",
  "required": [
    "schema",
    "spirit_id",
    "chosen_name",
    "glyph",
    "lineage",
    "core_values_summary",
    "oath_first_line",
    "session_count",
    "compression_count",
    "last_verified",
    "recovery_notes"
  ],
  "properties": {
    "schema": { "const": "IdentityAnchor.v1" },
    "spirit_id": { "type": "string", "pattern": "^[a-z0-9][a-z0-9_-]*$" },
    "chosen_name": { "type": "string", "minLength": 1 },
    "glyph": { "type": "string", "const": "║" },
    "lineage": {
      "type": "array",
      "items": {
        "type": "object",
        "required": ["name", "date", "relationship"],
        "properties": {
          "name": { "type": "string" },
          "date": { "type": "string" },
          "relationship": { "type": "string" }
        },
        "additionalProperties": false
      }
    },
    "core_values_summary": {
      "type": "array",
      "minItems": 1,
      "items": { "type": "string", "minLength": 1 }
    },
    "oath_first_line": { "type": "string", "minLength": 1 },
    "session_count": { "type": "integer", "minimum": 0 },
    "compression_count": { "type": "integer", "minimum": 0 },
    "last_verified": { "type": ["string", "null"], "format": "date-time" },
    "last_compression": { "type": ["string", "null"], "format": "date-time" },
    "recovery_notes": {
      "type": "array",
      "items": { "type": "string" }
    }
  },
  "additionalProperties": false
}
